{
  "schema_version": "agent2host/v1alpha1",
  "kind": "AgentSystem",
  "id": "club-system",
  "version": "1.0.0",
  "agents": [
    "./agents/club-faq.agent.json"
  ],
  "skills": {
    "search-policy": {
      "name": "Search policy",
      "description": "Search club policy documents.",
      "document": "./skills/search-policy.skill.md",
      "mcp_tools": [
        {
          "server_id": "club-database",
          "tool_name": "search_policy"
        }
      ]
    }
  }
}
